{
  "schema_version": "0.1.0",
  "candidate_id": "CAND-TEMPLATE-001",
  "artifact_status": "draft",
  "baseline_candidate_id": null,
  "changes": [{"change_type": "first_release", "description": "Initial production approval for this system."}],
  "declared_scope": "full",
  "assessed_by_actor_id": "ACT-SYSTEM",
  "assessed_at": "2026-07-31T00:00:00Z"
}
